{
    "h56i5SspnTk": {
        "title": "MCHSBC Full 12.22.25",
        "channel": "Medford Public Schools",
        "duration": 4630,
        "upload_date": "2025-12-22",
        "view_count": 2,
        "date": "2025-12-22",
        "priority": 0.07957282356644059,
        "meeting_type": "MPS High School Building Committee"
    },
    "30Tq2YcwQa8": {
        "title": "Medford Happenings Episode 32 The Christmas show",
        "channel": "Medford Happenings",
        "duration": 949,
        "upload_date": "2025-12-21",
        "view_count": 1,
        "date": "2025-12-21",
        "priority": 0.07370769421887305,
        "meeting_type": "Medford Happenings",
        "last_update": 1766334099.1985002
    },
    "WaNbAOKeDiY": {
        "title": "City Council 12-16-25",
        "channel": "City of Medford, Massachusetts",
        "duration": 13231,
        "upload_date": "2025-12-16",
        "view_count": 92,
        "date": "2025-12-16",
        "priority": 0.05385869361782133,
        "meeting_type": "CC City Council",
        "last_update": 1766128714.0198033
    },
    "izVdDtzaCdw": {
        "title": "MHS Advisory  Team - Sustainability / MEP",
        "channel": "Medford Public Schools",
        "duration": 10805,
        "upload_date": "2025-12-16",
        "view_count": 9,
        "date": "2025-12-16",
        "priority": 0.05385869361782133,
        "meeting_type": null,
        "last_update": 1766155362.808018
    },
    "Y-Q4wpPWQng": {
        "title": "City Council Planning and Permitting Committee 12-16-25",
        "channel": "City of Medford, Massachusetts",
        "duration": 3396,
        "upload_date": "2025-12-16",
        "view_count": 12,
        "date": "2025-12-16",
        "priority": 0.05385869361782133,
        "meeting_type": "CC Planning and Permitting",
        "last_update": 1766087274.7504036
    },
    "ir8Km2ErkFk": {
        "title": "Waste Collection Public Forum - 12-15-25 GOV - COM 22 VER 43",
        "channel": "Medford Community Media",
        "duration": 4352,
        "upload_date": "2025-12-15",
        "view_count": 4,
        "date": "2025-12-15",
        "priority": 0.05110618144917351,
        "meeting_type": "CC Solid Waste Task Force",
        "last_update": 1765938417.699314
    },
    "yUj2VRaLHcM": {
        "title": "12.15.2025 MSC Regular Meeting (In Person)",
        "channel": "Medford Public Schools",
        "duration": 8100,
        "upload_date": "2025-12-15",
        "view_count": 40,
        "date": "2025-12-15",
        "priority": 0.05110618144917351,
        "meeting_type": "MPS School Committee",
        "last_update": 1765892340.962338
    },
    "XXXXXX00143": {
        "title": "Medford For Palestine Update",
        "channel": "Medford Bytes ",
        "duration": 2339.0,
        "upload_date": "2025-12-15",
        "view_count": 100,
        "date": "2025-12-15",
        "url": "https://open.spotify.com/episode/55LoffTCYXj9NrPxJSUCiL",
        "priority": 0.05110618144917351,
        "meeting_type": "Medford Bytes",
        "last_update": 1765840974.3591485
    },
    "1IVQe-XX6k0": {
        "title": "Waste Collection Public Meeting 12 15 25",
        "channel": "Medford Community Media",
        "duration": 7538,
        "upload_date": "2025-12-16",
        "view_count": 6,
        "date": "2025-12-15",
        "priority": 0.05110618144917351,
        "meeting_type": "CC Solid Waste Task Force",
        "last_update": 1766178262.1276588
    },
    "YihOwP7qXJM": {
        "title": "City Council Public Health and Community Safety Committee 12-10-25",
        "channel": "City of Medford, Massachusetts",
        "duration": 1887,
        "upload_date": "2025-12-10",
        "view_count": 7,
        "date": "2025-12-10",
        "priority": 0.04070483741517764,
        "meeting_type": "CC Public Health and Community Safety",
        "last_update": 1765428523.5898957
    },
    "FO9h-BfJzLU": {
        "title": "City Council Resident Services and Public Engagement Committee 12-10-25",
        "channel": "City of Medford, Massachusetts",
        "duration": 1919,
        "upload_date": "2025-12-10",
        "view_count": 5,
        "date": "2025-12-10",
        "priority": 0.04070483741517764,
        "meeting_type": "CC Resident Services and Public Engagement Committee",
        "last_update": 1765422689.1142607
    },
    "NpSv2Fk755g": {
        "title": "Medford City Council Committee of the Whole 12-09-25",
        "channel": "City of Medford, Massachusetts",
        "duration": 2062,
        "upload_date": "2025-12-09",
        "view_count": 9,
        "date": "2025-12-09",
        "priority": 0.039112758922383,
        "meeting_type": "CC City Council Meeting of the Whole",
        "last_update": 1765395071.3396952
    },
    "6M-0h6z7BqQ": {
        "title": "Strategic & Capital Planning Meeting",
        "channel": "Medford Public Schools",
        "duration": 3395,
        "upload_date": "2025-12-08",
        "view_count": 3,
        "date": "2025-12-08",
        "priority": 0.03764053379822328,
        "last_update": 1765268174.9888346,
        "meeting_type": "MPS Strategic & Capital Planning"
    },
    "UHZzywcUcK0": {
        "title": "City Council 12-02-25",
        "channel": "City of Medford, Massachusetts",
        "duration": 10121,
        "upload_date": "2025-12-03",
        "view_count": 84,
        "date": "2025-12-02",
        "priority": 0.03070583065809256,
        "meeting_type": "CC City Council",
        "last_update": 1764810817.2780273
    },
    "xARk0471UWA": {
        "title": "MHS Advisory Team - Ed Planning & Equity/ Site Safety & Security #1",
        "channel": "Medford Public Schools",
        "duration": 10836,
        "upload_date": "2025-12-18",
        "view_count": 8,
        "date": "2025-12-01",
        "priority": 0.0297910710745541,
        "meeting_type": null,
        "last_update": 1766210968.3858202
    },
    "UIDbI2dyd14": {
        "title": "12.01.2025 MSC Regular Meeting (In Person)",
        "channel": "Medford Public Schools",
        "duration": 8223,
        "upload_date": "2025-12-02",
        "view_count": 102,
        "date": "2025-12-01",
        "priority": 0.0297910710745541,
        "last_update": 1764781065.388979,
        "meeting_type": "MPS School Committee"
    },
    "EjYtsXUKFn4": {
        "title": "MCHSBC Full Monthly",
        "channel": "Medford Public Schools",
        "duration": 7247,
        "upload_date": "2025-11-24",
        "view_count": 8,
        "date": "2025-11-24",
        "priority": 0.02465051447360224,
        "last_update": 1765742896.2679145,
        "meeting_type": "MPS High School Building Committee"
    },
    "bcKRqhwDHWE": {
        "title": "Strategic & Capital Planning Subcommittee",
        "channel": "Medford Public Schools",
        "duration": 4201,
        "upload_date": "2025-11-20",
        "view_count": 4,
        "date": "2025-11-20",
        "priority": 0.02243807418388388,
        "last_update": 1764008459.9556987,
        "meeting_type": "MPS Strategic & Capital Planning"
    },
    "9GYt_u4s5fY": {
        "title": "Public Health and Community Safety Committee 11-19-25",
        "channel": "City of Medford, Massachusetts",
        "duration": 4842,
        "upload_date": "2025-11-20",
        "view_count": 33,
        "date": "2025-11-19",
        "priority": 0.02194565592815397,
        "last_update": 1764022080.078168,
        "meeting_type": "CC Public Health and Community Safety"
    },
    "egZJOUPL-iU": {
        "title": "City Council 11-18-25",
        "channel": "City of Medford, Massachusetts",
        "duration": 14007,
        "upload_date": "2025-11-18",
        "view_count": 100,
        "date": "2025-11-18",
        "priority": 0.02147438643224373,
        "last_update": 1763587103.2511284,
        "meeting_type": "CC City Council"
    },
    "ObzNxwbGKmg": {
        "title": "City Council Committee of the Whole 11-18-25",
        "channel": "City of Medford, Massachusetts",
        "duration": 6493,
        "upload_date": "2025-11-18",
        "view_count": 55,
        "date": "2025-11-18",
        "priority": 0.02147438643224373,
        "last_update": 1763589351.6042836,
        "meeting_type": "CC City Council Meeting of the Whole"
    },
    "GvP0i0IR-AQ": {
        "title": "11.17.2025 MSC Regular Meeting (REMOTE ONLY)",
        "channel": "Medford Public Schools",
        "duration": 6208,
        "upload_date": "2025-11-17",
        "view_count": 20,
        "date": "2025-11-17",
        "priority": 0.02102293186934273,
        "last_update": 1763523112.3096268,
        "meeting_type": "MPS School Committee"
    },
    "JOz8NJmqO-Y": {
        "title": "City Council 11-12-25",
        "channel": "City of Medford, Massachusetts",
        "duration": 13008,
        "upload_date": "2025-11-12",
        "view_count": 120,
        "date": "2025-11-12",
        "priority": 0.01902330377353821,
        "last_update": 1763064398.3472505,
        "meeting_type": "CC City Council"
    },
    "E0jsJzFG3CI": {
        "title": "Medford Happenings   Episode 31   Gotta Know Medford",
        "channel": "Medford Happenings",
        "duration": 2668,
        "upload_date": "2025-11-10",
        "view_count": 2,
        "date": "2025-11-10",
        "priority": 0.01832605938426082,
        "last_update": 1762849920.3545518,
        "meeting_type": "Medford Happenings"
    },
    "i_KsYkZtn1w": {
        "title": "A City of Yes, a Medford that is Not For Sale, a Medford for All of Us!",
        "channel": "Zac Bears",
        "duration": 173,
        "upload_date": "2025-10-31",
        "view_count": 4,
        "date": "2025-10-31",
        "priority": 0.015487762779919353,
        "last_update": 1762204924.2377484,
        "meeting_type": "Campaign"
    },
    "sQqMa0Ysceo": {
        "title": "Medford Happenings Episode 29 Michael Marks and Robert Penta",
        "channel": "Medford Happenings",
        "duration": 3730,
        "upload_date": "2025-10-30",
        "view_count": 3,
        "date": "2025-10-29",
        "priority": 0.01502243496178943,
        "last_update": 1762221300.2259164,
        "meeting_type": "Medford Happenings"
    },
    "Y4wcHicGmic": {
        "title": "City Council 10-28-25",
        "channel": "City of Medford, Massachusetts",
        "duration": 5292,
        "upload_date": "2025-10-28",
        "view_count": 29,
        "date": "2025-10-28",
        "priority": 0.014800101401064058,
        "last_update": 1761799855.8831735,
        "meeting_type": "CC City Council"
    },
    "XXXXXX00142": {
        "title": "Erika Reinfeld",
        "channel": "Medford Bytes ",
        "duration": 1525.0,
        "upload_date": "2025-10-27",
        "view_count": 100,
        "date": "2025-10-27",
        "url": "https://open.spotify.com/episode/1bOJtZ0ByGBkE2ozuZ9IrG",
        "priority": 0.014584252978128978,
        "last_update": 1761580421.163318,
        "meeting_type": "Medford Bytes"
    },
    "T0WlE3L4gXY": {
        "title": "1-.27.2025 MHCSBC",
        "channel": "Medford Public Schools",
        "duration": 8663,
        "upload_date": "2025-10-27",
        "view_count": 16,
        "date": "2025-10-27",
        "priority": 0.014584252978128978,
        "last_update": 1765742374.594217,
        "meeting_type": "MPS High School Building Committee"
    },
    "54wilN-UHSY": {
        "title": "Patrick Clerkin for City Council",
        "channel": "Medford Happenings",
        "duration": 125,
        "upload_date": "2025-10-23",
        "view_count": 4,
        "date": "2025-10-23",
        "priority": 0.01378034861671694,
        "last_update": 1761247082.4071293,
        "meeting_type": "Medford Happenings"
    },
    "XXXXXX00141": {
        "title": "Justin Tseng",
        "channel": "Medford Bytes ",
        "duration": 2504.0,
        "upload_date": "2025-10-23",
        "view_count": 100,
        "date": "2025-10-23",
        "url": "https://open.spotify.com/episode/4tewujXULdmcS1FFILPHgR",
        "priority": 0.01378034861671694,
        "last_update": 1761246325.5994713,
        "meeting_type": "Medford Bytes"
    },
    "okS2_B9brgA": {
        "title": "2025 Candidates Forum - City Council - Caron Theater",
        "channel": "Medford Community Media",
        "duration": 4792,
        "upload_date": "2025-10-16",
        "view_count": 83,
        "date": "2025-10-23",
        "priority": 0.01378034861671694,
        "last_update": 1761323498.58454,
        "meeting_type": "Campaign"
    },
    "HaW-_4A8T8c": {
        "title": "Medford City Council Public Health and Community Safety Committee Meeting",
        "channel": "City of Medford, Massachusetts",
        "duration": 3484,
        "upload_date": "2025-10-22",
        "view_count": 6,
        "date": "2025-10-22",
        "priority": 0.01359303189839885,
        "last_update": 1761662281.943464,
        "meeting_type": "CC Public Health and Community Safety"
    },
    "6f-1_mZrcDs": {
        "title": "Data Talk #1: Minimums, not Momentum",
        "channel": "Dr. Lisa Kingsley",
        "duration": 37,
        "upload_date": "2025-10-21",
        "view_count": 0,
        "date": "2025-10-21",
        "priority": 0.01341073929142934,
        "last_update": 1761133710.6795294,
        "meeting_type": "Campaign"
    },
    "-ySCtNb9MFU": {
        "title": "Data Talk 2: The Gap is Growing",
        "channel": "Dr. Lisa Kingsley",
        "duration": 49,
        "upload_date": "2025-10-21",
        "view_count": 0,
        "date": "2025-10-21",
        "priority": 0.01341073929142934,
        "last_update": 1761106147.0463617,
        "meeting_type": "Campaign"
    },
    "kyJCraEqV1U": {
        "title": "Data Talk 3: Fewer Students Crossing the Stage",
        "channel": "Dr. Lisa Kingsley",
        "duration": 45,
        "upload_date": "2025-10-21",
        "view_count": 0,
        "date": "2025-10-21",
        "priority": 0.01341073929142934,
        "last_update": 1761107037.5410447,
        "meeting_type": "Campaign"
    },
    "7sMToEASoZ4": {
        "title": "Data Talk #4: Expanding Access to Challenge & Choice",
        "channel": "Dr. Lisa Kingsley",
        "duration": 35,
        "upload_date": "2025-10-21",
        "view_count": 0,
        "date": "2025-10-21",
        "priority": 0.01341073929142934,
        "last_update": 1761105158.1798973,
        "meeting_type": "Campaign"
    },
    "mWO5c6rny8k": {
        "title": "Data Talk #5: Progress Worth Watching",
        "channel": "Dr. Lisa Kingsley",
        "duration": 32,
        "upload_date": "2025-10-21",
        "view_count": 0,
        "date": "2025-10-21",
        "priority": 0.01341073929142934,
        "last_update": 1761104190.9228277,
        "meeting_type": "Campaign"
    },
    "o4xm49LNAj0": {
        "title": "Data Talk #6: Finding Bright Spots",
        "channel": "Dr. Lisa Kingsley",
        "duration": 33,
        "upload_date": "2025-10-21",
        "view_count": 0,
        "date": "2025-10-21",
        "priority": 0.01341073929142934,
        "last_update": 1761149668.5665512,
        "meeting_type": "Campaign"
    },
    "sAkPmqbndfk": {
        "title": "City Council 10-21-25",
        "channel": "City of Medford, Massachusetts",
        "duration": 4742,
        "upload_date": "2025-10-21",
        "view_count": 25,
        "date": "2025-10-21",
        "priority": 0.01341073929142934,
        "last_update": 1761255706.1479967,
        "meeting_type": "CC City Council"
    },
    "CDjpOlSb3Do": {
        "title": "2025 Candidate Profile - City Council - Patrick Clerkin",
        "channel": "Medford Community Media",
        "duration": 223,
        "upload_date": "2025-10-21",
        "view_count": 0,
        "date": "2025-10-21",
        "priority": 0.01341073929142934,
        "last_update": 1761069826.2220318,
        "meeting_type": "Campaign"
    },
    "ERsNC4IXjMo": {
        "title": "Data Talk #7:  More than Metrics",
        "channel": "Dr. Lisa Kingsley",
        "duration": 30,
        "upload_date": "2025-10-21",
        "view_count": 0,
        "date": "2025-10-21",
        "priority": 0.01341073929142934,
        "last_update": 1761166295.8845043,
        "meeting_type": "Campaign"
    },
    "Om-JJy1cLFc": {
        "title": "AJ Olapade Candidate Profile 2025 School Committee",
        "channel": "Elect Aaron Olapade",
        "duration": 250,
        "upload_date": "2025-10-21",
        "view_count": 35,
        "date": "2025-10-21",
        "priority": 0.01341073929142934,
        "last_update": 1764181197.120239,
        "meeting_type": "Campaign"
    },
    "32kH94lcvHQ": {
        "title": "2025 Candidate Profile - City Council - Nate Merritt",
        "channel": "Medford Community Media",
        "duration": 281,
        "upload_date": "2025-10-20",
        "view_count": 4,
        "date": "2025-10-20",
        "priority": 0.013233271339522262,
        "last_update": 1761006668.7664738,
        "meeting_type": "Campaign"
    },
    "CEqJHmZ3sV8": {
        "title": "2025 Candidate Profile - City Council - Isaac B. \"Zac\" Bears II",
        "channel": "Medford Community Media",
        "duration": 174,
        "upload_date": "2025-10-20",
        "view_count": 5,
        "date": "2025-10-20",
        "priority": 0.013233271339522262,
        "last_update": 1761010301.0226812,
        "meeting_type": "Campaign"
    },
    "D73ugmGBlE4": {
        "title": "2025 Candidate Profile - City Council - Emily K Lazzaro",
        "channel": "Medford Community Media",
        "duration": 215,
        "upload_date": "2025-10-20",
        "view_count": 1,
        "date": "2025-10-20",
        "priority": 0.013233271339522262,
        "last_update": 1761016917.6033947,
        "meeting_type": "Campaign"
    },
    "EP0Ya0FfytQ": {
        "title": "2025 Candidate Profile - School Committee - Nicole Branley",
        "channel": "Medford Community Media",
        "duration": 268,
        "upload_date": "2025-10-20",
        "view_count": 1,
        "date": "2025-10-20",
        "priority": 0.013233271339522262,
        "last_update": 1761018614.3581884,
        "meeting_type": "Campaign"
    },
    "Frk8ymclPvU": {
        "title": "2025 Candidate Profile - School Committee - John L. Intoppa",
        "channel": "Medford Community Media",
        "duration": 290,
        "upload_date": "2025-10-20",
        "view_count": 1,
        "date": "2025-10-20",
        "priority": 0.013233271339522262,
        "last_update": 1761024357.2243097,
        "meeting_type": "Campaign"
    },
    "GbYffrAJf-M": {
        "title": "2025 Candidate Profile - School Committee - Erika Reinfeld",
        "channel": "Medford Community Media",
        "duration": 236,
        "upload_date": "2025-10-20",
        "view_count": 0,
        "date": "2025-10-20",
        "priority": 0.013233271339522262,
        "last_update": 1761026429.2849696,
        "meeting_type": "Campaign"
    },
    "BoJTzaU_Gdw": {
        "title": "2025 Candidate Profile - City Council - Liz Mullane",
        "channel": "Medford Community Media",
        "duration": 224,
        "upload_date": "2025-10-20",
        "view_count": 4,
        "date": "2025-10-20",
        "priority": 0.013233271339522262,
        "last_update": 1761155046.390284,
        "meeting_type": "Campaign"
    },
    "DufGRmZgg08": {
        "title": "2025 Candidate Profile - City Council - Nick Giurleo",
        "channel": "Medford Community Media",
        "duration": 299,
        "upload_date": "2025-10-20",
        "view_count": 3,
        "date": "2025-10-20",
        "priority": 0.013233271339522262,
        "last_update": 1761054644.0338273,
        "meeting_type": "Campaign"
    },
    "HugeKdadTjM": {
        "title": "2025 Candidate Profile - City Council - Paul J Donato Jr.",
        "channel": "Medford Community Media",
        "duration": 184,
        "upload_date": "2025-10-20",
        "view_count": 4,
        "date": "2025-10-20",
        "priority": 0.013233271339522262,
        "last_update": 1761058019.9348588,
        "meeting_type": "Campaign"
    },
    "IHTAxgFn1HI": {
        "title": "2025 Candidate Profile - School Committee - Jessica Eisenman Parks",
        "channel": "Medford Community Media",
        "duration": 292,
        "upload_date": "2025-10-20",
        "view_count": 4,
        "date": "2025-10-20",
        "priority": 0.013233271339522262,
        "last_update": 1761060376.4312243,
        "meeting_type": "Campaign"
    },
    "SX3yb0h1dRk": {
        "title": "2025 Candidate Profile - City Council - Rick Caraviello",
        "channel": "Medford Community Media",
        "duration": 192,
        "upload_date": "2025-10-20",
        "view_count": 4,
        "date": "2025-10-20",
        "priority": 0.013233271339522262,
        "last_update": 1763499473.8122737,
        "meeting_type": "Campaign"
    },
    "cWI7iQQIL34": {
        "title": "2025 Candidate Profile - City Council - Miranda Brise\u00f1o",
        "channel": "Medford Community Media",
        "duration": 198,
        "upload_date": "2025-10-20",
        "view_count": 5,
        "date": "2025-10-20",
        "priority": 0.013233271339522262,
        "last_update": 1761109701.3585587,
        "meeting_type": "Campaign"
    },
    "elvTC9g_XY4": {
        "title": "2025 Candidate Profile - City Council - Justin Tseng",
        "channel": "Medford Community Media",
        "duration": 282,
        "upload_date": "2025-10-20",
        "view_count": 0,
        "date": "2025-10-20",
        "priority": 0.013233271339522262,
        "last_update": 1761111328.2956543,
        "meeting_type": "Campaign"
    },
    "fr7q6GxmdPE": {
        "title": "2025 Candidate Profile - School Committee - Michael A Mastrobuoni",
        "channel": "Medford Community Media",
        "duration": 193,
        "upload_date": "2025-10-20",
        "view_count": 1,
        "date": "2025-10-20",
        "priority": 0.013233271339522262,
        "last_update": 1761068269.655762,
        "meeting_type": "Campaign"
    },
    "jfPSkxRIVQU": {
        "title": "2025 Candidate Profile - School Committee - Aaron Olapade",
        "channel": "Medford Community Media",
        "duration": 250,
        "upload_date": "2025-10-20",
        "view_count": 1,
        "date": "2025-10-20",
        "priority": 0.013233271339522262,
        "last_update": 1761056489.1740484,
        "meeting_type": "Campaign"
    },
    "MUexJD4IqOc": {
        "title": "2025 Candidate Profile - Mayor - Breanna Lungo-Koehn",
        "channel": "Medford Community Media",
        "duration": 296,
        "upload_date": "2025-10-20",
        "view_count": 4,
        "date": "2025-10-20",
        "priority": 0.013233271339522262,
        "last_update": 1761022145.4217687,
        "meeting_type": "Campaign"
    },
    "q5q1AJYD1Gg": {
        "title": "2025 Candidate Profile - City Council - Melanie Tringali",
        "channel": "Medford Community Media",
        "duration": 301,
        "upload_date": "2025-10-20",
        "view_count": 1,
        "date": "2025-10-20",
        "priority": 0.013233271339522262,
        "last_update": 1761020395.1793656,
        "meeting_type": "Campaign"
    },
    "cIKccYcHMtE": {
        "title": "2025 Candidate Profile - City Council - Charles Patrick Clerkin",
        "channel": "Medford Community Media",
        "duration": 223,
        "upload_date": "2025-10-20",
        "view_count": 1,
        "date": "2025-10-20",
        "priority": 0.013233271339522262,
        "last_update": 1761015142.0085876,
        "meeting_type": "Campaign"
    },
    "wMWBXVaYZ_w": {
        "title": "2025 Candidate Profile - City Council - Matt Leming",
        "channel": "Medford Community Media",
        "duration": 201,
        "upload_date": "2025-10-20",
        "view_count": 1,
        "date": "2025-10-20",
        "priority": 0.013233271339522262,
        "last_update": 1761012977.699285,
        "meeting_type": "Campaign"
    },
    "yvN6XN_Bmmk": {
        "title": "2025 Candidate Profile - City Council - Anna Callahan",
        "channel": "Medford Community Media",
        "duration": 213,
        "upload_date": "2025-10-20",
        "view_count": 3,
        "date": "2025-10-20",
        "priority": 0.013233271339522262,
        "last_update": 1761008296.0445197,
        "meeting_type": "Campaign"
    },
    "BvvNXiHAPeI": {
        "title": "10.20.2025 MSC Regular Meeting (In Person)",
        "channel": "Medford Public Schools",
        "duration": 12974,
        "upload_date": "2025-10-20",
        "view_count": 35,
        "date": "2025-10-20",
        "priority": 0.013233271339522262,
        "last_update": 1761255316.5486362,
        "meeting_type": "MPS School Committee"
    },
    "yW_ZzvRt6vQ": {
        "title": "Medford Happenings Episode 28   Doug Shoop Medford Rotary 10 18 25",
        "channel": "Medford Happenings",
        "duration": 1973,
        "upload_date": "2025-10-24",
        "view_count": 1,
        "date": "2025-10-18",
        "priority": 0.01289206300381097,
        "last_update": 1761372365.4048371,
        "meeting_type": "Medford Happenings"
    },
    "ntWR6BrwZ7g": {
        "title": "2025 Candidates Forum - School Committee - Candidates Forum - Caron Theater",
        "channel": "Medford Community Media",
        "duration": 6585,
        "upload_date": "2025-10-16",
        "view_count": 52,
        "date": "2025-10-16",
        "priority": 0.01256800790434066,
        "last_update": 1760722709.9475915,
        "meeting_type": "Campaign"
    },
    "FIywS_b8DHU": {
        "title": "Medford Happenings Episode 27 Michelle Corrado",
        "channel": "Medford Happenings",
        "duration": 1973,
        "upload_date": "2025-10-15",
        "view_count": 4,
        "date": "2025-10-15",
        "priority": 0.012412013619067437,
        "last_update": 1760772563.5732548,
        "meeting_type": "Medford Happenings"
    },
    "MCM00001830": {
        "title": "Community Preservation Committee 10-14-25",
        "channel": "MCM Archive",
        "duration": 8633,
        "upload_date": "2025-11-26",
        "view_count": 10,
        "date": "2025-10-14",
        "url": "https://archive.org/details/community-preservation-committee-10-14-25",
        "priority": 0.0122598442650816,
        "meeting_type": "CC Community Preservation Committee",
        "last_update": 1765620219.369973
    },
    "MCM00001829": {
        "title": "Traffic Commission 10-14-25",
        "channel": "MCM Archive",
        "duration": 5557,
        "upload_date": "2025-11-26",
        "view_count": 10,
        "date": "2025-10-14",
        "url": "https://archive.org/details/trafffic-commission-10-14-25",
        "priority": 0.0122598442650816,
        "meeting_type": "CC Traffic Commission",
        "last_update": 1765638750.9164002
    },
    "8Nu2-4z_hmI": {
        "title": "Medford Happenings Short #4 Patrick Clerkin",
        "channel": "Medford Happenings",
        "duration": 570,
        "upload_date": "2025-10-14",
        "view_count": 8,
        "date": "2025-10-14",
        "priority": 0.0122598442650816,
        "last_update": 1760510547.9126854,
        "meeting_type": "Medford Happenings"
    },
    "XpeAyM9qjgI": {
        "title": "Strategic & Capital Planning Subcommittee",
        "channel": "Medford Public Schools",
        "duration": 6102,
        "upload_date": "2025-10-14",
        "view_count": 4,
        "date": "2025-10-14",
        "priority": 0.0122598442650816,
        "last_update": 1760772450.4688253,
        "meeting_type": "MPS Strategic & Capital Planning"
    },
    "S-oZsWBzn2o": {
        "title": "2025 Aaron Olapade Joint Campaign Kickoff Speech",
        "channel": "Elect Aaron Olapade",
        "duration": 293,
        "upload_date": "2025-10-14",
        "view_count": 4,
        "date": "2025-10-14",
        "priority": 0.0122598442650816,
        "last_update": 1764183929.6223123,
        "meeting_type": "Campaign"
    },
    "HeJP0Rfdf2g": {
        "title": "Medford Happenings Short #2 - Nate Merritt",
        "channel": "Medford Happenings",
        "duration": 1011,
        "upload_date": "2025-10-12",
        "view_count": 6,
        "date": "2025-10-12",
        "priority": 0.011966431101651447,
        "last_update": 1760332430.1027188,
        "meeting_type": "Medford Happenings"
    },
    "PIGC3TQVfE4": {
        "title": "Medford Happenings Short #3 - Nick Giurleo",
        "channel": "Medford Happenings",
        "duration": 1030,
        "upload_date": "2025-10-12",
        "view_count": 5,
        "date": "2025-10-12",
        "priority": 0.011966431101651447,
        "last_update": 1760328464.3226275,
        "meeting_type": "Medford Happenings"
    },
    "MCM00001828": {
        "title": "Historical District Commission 10-09-25",
        "channel": "MCM Archive",
        "duration": 2873,
        "upload_date": "2025-11-26",
        "view_count": 10,
        "date": "2025-10-09",
        "url": "https://archive.org/details/historical-district-commission-10-09-25",
        "priority": 0.0115517320834089,
        "meeting_type": "CC Historical Commission",
        "last_update": 1765644928.2682278
    },
    "MCM00001827": {
        "title": "Medford City Council Public Health and Community Safety Committee 10-8-25",
        "channel": "MCM Archive",
        "duration": 0,
        "upload_date": "2025-11-26",
        "view_count": 10,
        "date": "2025-10-08",
        "url": "https://archive.org/details/cc-public-health-community-safety-10-08-25",
        "priority": 0.011419813457900723,
        "meeting_type": "CC Public Health and Community Safety",
        "duplicate_id": "2UhDsuA0gwU",
        "skip": true
    },
    "2UhDsuA0gwU": {
        "title": "City Council Public Health and Community Safety Committee 10-8-25",
        "channel": "City of Medford, Massachusetts",
        "duration": 5607,
        "upload_date": "2025-10-08",
        "view_count": 9,
        "date": "2025-10-08",
        "priority": 0.011419813457900723,
        "last_update": 1761009039.762284,
        "meeting_type": "CC Public Health and Community Safety",
        "duplicate_id": "MCM00001827"
    },
    "9XNxJ6SowDU": {
        "title": "Rules and Policy Subcommittee- Management of Life-Threatening Allergies Policy.",
        "channel": "Medford Public Schools",
        "duration": 5816,
        "upload_date": "2025-10-08",
        "view_count": 10,
        "date": "2025-10-08",
        "priority": 0.011419813457900723,
        "last_update": 1761011010.4398518,
        "meeting_type": "MPS Rules & Policy"
    },
    "MCM00001826": {
        "title": "Medford City Council 10-07-25",
        "channel": "MCM Archive",
        "duration": 0,
        "upload_date": "2025-11-26",
        "view_count": 10,
        "date": "2025-10-07",
        "url": "https://archive.org/details/city-council-10-07-25",
        "priority": 0.011290873785493684,
        "meeting_type": "CC City Council",
        "duplicate_id": "vKjSCLc-dk0",
        "skip": true
    },
    "MCM00001825": {
        "title": "School Committee Rules & Policies 10/07/25",
        "channel": "MCM Archive",
        "duration": 5862,
        "upload_date": "2025-11-26",
        "view_count": 10,
        "date": "2025-10-07",
        "url": "https://archive.org/details/sc-rules-policies-10-07-25",
        "priority": 0.011290873785493684,
        "meeting_type": "MPS Rules & Policy",
        "last_update": 1765813610.0542402
    },
    "vKjSCLc-dk0": {
        "title": "City Council 10-7-25",
        "channel": "City of Medford, Massachusetts",
        "duration": 4441,
        "upload_date": "2025-10-08",
        "view_count": 41,
        "date": "2025-10-07",
        "priority": 0.011290873785493684,
        "last_update": 1760216149.7036018,
        "meeting_type": "CC City Council",
        "duplicate_id": "MCM00001826"
    },
    "P8rYkRI7D6M": {
        "title": "10.06.2026 MSC regular Meeting (In Person)",
        "channel": "Medford Public Schools",
        "duration": 9101,
        "upload_date": "2025-10-07",
        "view_count": 72,
        "date": "2025-10-07",
        "priority": 0.011290873785493684,
        "last_update": 1760330915.1332817,
        "meeting_type": "MPS School Committee"
    },
    "MCM00001824": {
        "title": "Medford School Committee 10-06-25",
        "channel": "MCM Archive",
        "duration": 5836,
        "upload_date": "2025-10-10",
        "view_count": 10,
        "date": "2025-10-06",
        "url": "https://archive.org/details/school-committee-10-06-25",
        "priority": 0.01116481328782228,
        "meeting_type": "MPS School Committee",
        "last_update": 1765829733.8712988
    },
    "MCM00001823": {
        "title": "Medford Energy And Environment Committee 10-06-25",
        "channel": "MCM Archive",
        "duration": 5299,
        "upload_date": "2025-10-10",
        "view_count": 10,
        "date": "2025-10-06",
        "url": "https://archive.org/details/energy-and-enviroment-10-06-25",
        "priority": 0.01116481328782228,
        "meeting_type": "CC Energy & Environment Committee",
        "last_update": 1765963279.2343872
    },
    "XXXXXX00140": {
        "title": "Charter Ballot Question",
        "channel": "Medford Bytes ",
        "duration": 2504.0,
        "upload_date": "2025-10-06",
        "view_count": 100,
        "date": "2025-10-06",
        "url": "https://podcasts.apple.com/us/podcast/charter-ballot-question/id1591707053?i=1000730372640",
        "priority": 0.01116481328782228,
        "last_update": 1759974592.7852132,
        "meeting_type": "Medford Bytes"
    },
    "8kO0cYAYtwY": {
        "title": "Medford Happenings Short #5 Rick Caraviello",
        "channel": "Medford Happenings",
        "duration": 913,
        "upload_date": "2025-10-26",
        "view_count": 2,
        "date": "2025-10-05",
        "priority": 0.011041536593346906,
        "last_update": 1761533234.4253392,
        "meeting_type": "Medford Happenings"
    },
    "lEtUveSUXZk": {
        "title": "Anna Callahan at the Medford Democratic City Committee Candidates Forum",
        "channel": "Anna Callahan for Medford",
        "duration": 185,
        "upload_date": "2025-10-04",
        "view_count": 1,
        "date": "2025-10-04",
        "priority": 0.010920952496720166,
        "last_update": 1759972727.6990573,
        "meeting_type": "Campaign"
    },
    "jGGRj9qmUY4": {
        "title": "Medford Happenings Episode 26 Milva McDonald and Ron Giovino",
        "channel": "Medford Happenings",
        "duration": 2250,
        "upload_date": "2025-10-03",
        "view_count": 2,
        "date": "2025-10-03",
        "priority": 0.01080297373375056,
        "last_update": 1759972680.2803497,
        "meeting_type": "Medford Happenings"
    },
    "MCM00001822": {
        "title": "Medford Conservation Commission 10-01-25",
        "channel": "MCM Archive",
        "duration": 1099,
        "upload_date": "2025-10-10",
        "view_count": 10,
        "date": "2025-10-01",
        "url": "https://archive.org/details/conservation-commission-10-01-25",
        "priority": 0.010574501607523403,
        "meeting_type": "CC Conservation Commission",
        "last_update": 1765965020.4580202
    },
    "MCM00001821": {
        "title": "Medford Affordable Housing Trust 10-01-25",
        "channel": "MCM Archive",
        "duration": 4430,
        "upload_date": "2025-10-10",
        "view_count": 10,
        "date": "2025-10-01",
        "url": "https://archive.org/details/affordable-housing-trust-10-01-25",
        "priority": 0.010574501607523403,
        "meeting_type": "CC Affordable Housing Trust Fund Board",
        "last_update": 1765863148.7828538
    },
    "MCM00001820": {
        "title": "Medford City Council 09-30-25",
        "channel": "MCM Archive",
        "duration": 0,
        "upload_date": "2025-10-10",
        "view_count": 10,
        "date": "2025-09-30",
        "url": "https://archive.org/details/city-council-09-30-25",
        "priority": 0.010463851592042463,
        "meeting_type": "CC City Council",
        "duplicate_id": "L2PVZXRYAAI",
        "skip": true
    },
    "MCM00001819": {
        "title": "City Council Resident Services And Public Engagement Committee 09-30-25",
        "channel": "MCM Archive",
        "duration": 0,
        "upload_date": "2025-10-10",
        "view_count": 10,
        "date": "2025-09-30",
        "url": "https://archive.org/details/city-council-resident-services-and-public-engagement-committee-09-30-25",
        "priority": 0.010463851592042463,
        "meeting_type": "CC Resident Services and Public Engagement Committee",
        "duplicate_id": "F1G_uayzNSg",
        "skip": true
    },
    "F1G_uayzNSg": {
        "title": "City Council Resident Services and Public Engagement Committee 9-30-25",
        "channel": "City of Medford, Massachusetts",
        "duration": 1415,
        "upload_date": "2025-10-01",
        "view_count": 12,
        "date": "2025-09-30",
        "priority": 0.010463851592042463,
        "last_update": 1760769690.8831942,
        "meeting_type": "CC Resident Services and Public Engagement Committee",
        "duplicate_id": "MCM00001819"
    },
    "L2PVZXRYAAI": {
        "title": "City Council 09-30-25",
        "channel": "City of Medford, Massachusetts",
        "duration": 11947,
        "upload_date": "2025-10-01",
        "view_count": 96,
        "date": "2025-09-30",
        "priority": 0.010463851592042463,
        "last_update": 1761007666.7110445,
        "meeting_type": "CC City Council",
        "duplicate_id": "MCM00001820"
    },
    "XXXXXX00139": {
        "title": "Mike Mastrobuoni, Candidate for School Committee",
        "channel": "Medford Bytes ",
        "duration": 1366.0,
        "upload_date": "2025-09-29",
        "view_count": 100,
        "date": "2025-09-29",
        "url": "https://open.spotify.com/episode/1bV9cvbINce0JCtxRFVkSc",
        "priority": 0.01035549324753783,
        "last_update": 1759164274.665346,
        "meeting_type": "Medford Bytes"
    },
    "nkHqlN0kjxk": {
        "title": "Aaron Olapade - Medford Juneteenth Flag Raising 2025",
        "channel": "Elect Aaron Olapade",
        "duration": 158,
        "upload_date": "2025-09-29",
        "view_count": 63,
        "date": "2025-09-29",
        "priority": 0.01035549324753783,
        "last_update": 1764185836.337674,
        "meeting_type": "Campaign"
    },
    "gT4_C1uPttA": {
        "title": "\u2615\ufe0f Coffee Chat #7: Oversight in Special Education",
        "channel": "Dr. Lisa Kingsley",
        "duration": 236,
        "upload_date": "2025-09-27",
        "view_count": 2,
        "date": "2025-09-27",
        "priority": 0.010145372573187043,
        "last_update": 1759323090.961088,
        "meeting_type": "Campaign"
    },
    "B1bsuzExTVI": {
        "title": "Coffee Chat #6: Introduction to Special Education with David",
        "channel": "Dr. Lisa Kingsley",
        "duration": 207,
        "upload_date": "2025-09-27",
        "view_count": 0,
        "date": "2025-09-26",
        "priority": 0.010043477749487974,
        "last_update": 1759323045.6040394,
        "meeting_type": "Campaign"
    },
    "RCgO7RGIkoU": {
        "title": "Medford Happenings w/ Patrick Clerkin",
        "channel": "Medford Happenings",
        "duration": 1959,
        "upload_date": "2025-09-26",
        "view_count": 3,
        "date": "2025-09-26",
        "priority": 0.010043477749487974,
        "last_update": 1759323000.617119,
        "meeting_type": "Medford Happenings"
    },
    "uxpf4p7kZy8": {
        "title": "Coffee Chat #5: Family Partnerships",
        "channel": "Dr. Lisa Kingsley",
        "duration": 161,
        "upload_date": "2025-09-29",
        "view_count": 0,
        "date": "2025-09-25",
        "priority": 0.009943609330428217,
        "last_update": 1759323209.4130752,
        "meeting_type": "Campaign"
    },
    "MCM00001818": {
        "title": "Medford Commission For Persons With Disabilities 09-24-25",
        "channel": "MCM Archive",
        "duration": 5355,
        "upload_date": "2025-10-10",
        "view_count": 10,
        "date": "2025-09-24",
        "url": "https://archive.org/details/commission-for-persons-with-disabilities-09-24-25",
        "priority": 0.009845707461845939,
        "meeting_type": "CC Commission for Persons with Disabilities",
        "last_update": 1766078503.777469
    },
    "MCM00001816": {
        "title": "Medford Bicycle Advisory Commission 09-24-25",
        "channel": "MCM Archive",
        "duration": 7062,
        "upload_date": "2025-09-25",
        "view_count": 10,
        "date": "2025-09-24",
        "url": "https://archive.org/details/bicycle-advisory-commission-09-24-25",
        "priority": 0.009845707461845939,
        "meeting_type": "CC Bicycling Advisory Commission",
        "last_update": 1766005179.256174
    },
    "M5KmcMSF_Lk": {
        "title": "Coffee Chat #4: Superintendent Selection with Nathan",
        "channel": "Dr. Lisa Kingsley",
        "duration": 176,
        "upload_date": "2025-09-29",
        "view_count": 0,
        "date": "2025-09-24",
        "priority": 0.009845707461845939,
        "last_update": 1759323154.811099,
        "meeting_type": "Campaign"
    },
    "4vDGNnYooSk": {
        "title": "Coffee Chat #3: Strategic Planning with Caroline",
        "channel": "Dr. Lisa Kingsley",
        "duration": 135,
        "upload_date": "2025-09-29",
        "view_count": 0,
        "date": "2025-09-23",
        "priority": 0.009749714623823293,
        "last_update": 1759168685.7947013,
        "meeting_type": "Campaign"
    },
    "MCM00001815": {
        "title": "Medford School Committee 09-22-25",
        "channel": "MCM Archive",
        "duration": 0,
        "upload_date": "2025-09-23",
        "view_count": 10,
        "date": "2025-09-22",
        "url": "https://archive.org/details/school-committee-09-22-25",
        "priority": 0.009655575517994076,
        "meeting_type": "MPS School Committee",
        "duplicate_id": "ewRLf8jM8M0",
        "skip": true
    },
    "JGsQ-T4cCS4": {
        "title": "Coffee Chat #2: Clear Vision for Learning with Annie",
        "channel": "Dr. Lisa Kingsley",
        "duration": 134,
        "upload_date": "2025-09-29",
        "view_count": 0,
        "date": "2025-09-22",
        "priority": 0.009655575517994076,
        "last_update": 1759169256.6292832,
        "meeting_type": "Campaign"
    },
    "ewRLf8jM8M0": {
        "title": "09.22.2025 MSC Regular Meeting",
        "channel": "Medford Public Schools",
        "duration": 12025,
        "upload_date": "2025-09-23",
        "view_count": 77,
        "date": "2025-09-22",
        "priority": 0.009655575517994076,
        "last_update": 1761004608.0642073,
        "meeting_type": "MPS School Committee",
        "duplicate_id": "MCM00001815"
    },
    "QjYSA4a31Ac": {
        "title": "Coffee Chat #1: Introductions with special guest Nathan",
        "channel": "Dr. Lisa Kingsley",
        "duration": 248,
        "upload_date": "2025-09-27",
        "view_count": 0,
        "date": "2025-09-21",
        "priority": 0.009563236961317601,
        "last_update": 1759323128.4360735,
        "meeting_type": "Campaign"
    },
    "D0FrTqJ9PNo": {
        "title": "Medford Happenings Episode 25 George Scarpelli 09 19 25",
        "channel": "Medford Happenings",
        "duration": 2771,
        "upload_date": "2025-09-26",
        "view_count": 3,
        "date": "2025-09-19",
        "priority": 0.0093837587443966,
        "last_update": 1759189524.2052667,
        "meeting_type": "Medford Happenings",
        "manual_correction": true
    },
    "MCM00001817": {
        "title": "Medford Community Development Block Grant Public Hearing 9/17/25",
        "channel": "MCM Archive",
        "duration": 747,
        "upload_date": "2025-09-26",
        "view_count": 10,
        "date": "2025-09-17",
        "url": "https://archive.org/details/cdbg-caper-hearing-09-17-25",
        "priority": 0.00921089314618811,
        "meeting_type": "MPS High School Building Committee",
        "last_update": 1766209616.565885
    },
    "MCM00001814": {
        "title": "Medford Community Development Board 09-17-25",
        "channel": "MCM Archive",
        "duration": 10787,
        "upload_date": "2025-09-18",
        "view_count": 10,
        "date": "2025-09-17",
        "url": "https://archive.org/details/community-development-board-09-17-25",
        "priority": 0.00921089314618811,
        "meeting_type": "MPS High School Building Committee",
        "last_update": 1766261553.868428
    },
    "MCM00001813": {
        "title": "Medford Conservation Commission 09-17-25",
        "channel": "MCM Archive",
        "duration": 2686,
        "upload_date": "2025-09-18",
        "view_count": 10,
        "date": "2025-09-17",
        "url": "https://archive.org/details/conservation-commission-09-17-25",
        "meeting_type": "CC Conservation Commission",
        "priority": 0.00921089314618811,
        "last_update": 1766230776.030659
    },
    "MCM00001810": {
        "title": "Medford Historic District Commission 09-11-25.mp 4",
        "channel": "MCM Archive",
        "duration": 3822,
        "upload_date": "2025-09-17",
        "view_count": 10,
        "date": "2025-09-17",
        "url": "https://archive.org/details/historic-district-commission-09-11-25.mp-4",
        "meeting_type": "CC Historical Commission",
        "priority": 0.00921089314618811,
        "last_update": 1766223086.2050612
    },
    "MCM00001812": {
        "title": "Medford Board Of Health 09-16-25",
        "channel": "MCM Archive",
        "duration": 1920,
        "upload_date": "2025-09-17",
        "view_count": 10,
        "date": "2025-09-16",
        "url": "https://archive.org/details/board-of-health-09-16-25",
        "meeting_type": "CC Board of Health",
        "priority": 0.009126826918676428,
        "last_update": 1766263988.34067
    },
    "MCM00001811": {
        "title": "Medford School Committee Subcommittee 09-15-25",
        "channel": "MCM Archive",
        "duration": 4544,
        "upload_date": "2025-09-17",
        "view_count": 10,
        "date": "2025-09-15",
        "url": "https://archive.org/details/mchsbc-meeting-09-15-25",
        "meeting_type": "MPS School Committee",
        "priority": 0.00904428132838841,
        "last_update": 1766276693.4149675
    },
    "mtlACKVIlfY": {
        "title": "MHCSBC Full Meeting",
        "channel": "Medford Public Schools",
        "duration": 4587,
        "upload_date": "2025-09-15",
        "view_count": 18,
        "date": "2025-09-15",
        "priority": 0.00904428132838841,
        "last_update": 1758439209.104474,
        "meeting_type": "MPS High School Building Committee"
    },
    "XXXXXX00138": {
        "title": "Dr Lisa Kingsley",
        "channel": "Medford Bytes",
        "duration": 1633,
        "upload_date": "2025-09-15",
        "view_count": 100,
        "date": "2025-09-15",
        "priority": 0.00904428132838841,
        "url": "https://open.spotify.com/episode/7eN34X8RyOvIPdIWU3aT3Z",
        "last_update": 1759968208.9545865,
        "meeting_type": "Medford Bytes"
    },
    "iM6Cr_t82ss": {
        "title": "Medford Happenings Episode 24   Rick Caraviello 09 12 25",
        "channel": "Medford Happenings",
        "duration": 2822,
        "upload_date": "2025-09-16",
        "view_count": 7,
        "date": "2025-09-12",
        "priority": 0.008805366687815733,
        "last_update": 1763499394.8939624,
        "meeting_type": "Medford Happenings"
    },
    "MCM00001809": {
        "title": "Medford Traffic Commission 09-09-25",
        "channel": "MCM Archive",
        "duration": 6004,
        "upload_date": "2025-09-11",
        "view_count": 10,
        "date": "2025-09-09",
        "url": "https://archive.org/details/traffic-commission-09-09-25",
        "meeting_type": "CC Traffic Commission",
        "priority": 0.008578749580478556,
        "last_update": 1766296536.229816
    },
    "MCM00001808": {
        "title": "Medford City Council Meeting 09-09-25",
        "channel": "MCM Archive",
        "duration": 0,
        "upload_date": "2025-09-11",
        "view_count": 10,
        "date": "2025-09-09",
        "url": "https://archive.org/details/city-council-meeting-09-09-25",
        "priority": 0.008578749580478556,
        "meeting_type": "CC City Council",
        "duplicate_id": "rNW_qqbEEfU",
        "skip": true
    },
    "MCM00001807": {
        "title": "Medford Affordable Housing Trust And Community Preservation Committee Joint Meeting 09-09-25",
        "channel": "MCM Archive",
        "duration": 6602,
        "upload_date": "2025-09-10",
        "view_count": 10,
        "date": "2025-09-09",
        "url": "https://archive.org/details/affordable-housing-trust-and-community-preservation-committee-joint-meeting-09-09-25",
        "meeting_type": "CC Affordable Housing Trust Fund Board",
        "priority": 0.008578749580478556,
        "last_update": 1766314142.466577
    },
    "rNW_qqbEEfU": {
        "title": "City Council 09-09-25",
        "channel": "City of Medford, Massachusetts",
        "duration": 11121,
        "upload_date": "2025-09-09",
        "view_count": 78,
        "date": "2025-09-09",
        "priority": 0.008578749580478556,
        "last_update": 1758118917.3897216,
        "meeting_type": "CC City Council",
        "duplicate_id": "MCM00001808"
    },
    "MCM00001806": {
        "title": "Medford Historical Commission 09-08-25",
        "channel": "MCM Archive",
        "duration": 5381,
        "upload_date": "2025-09-09",
        "view_count": 10,
        "date": "2025-09-08",
        "url": "https://archive.org/details/historical-commission-09-08-25",
        "meeting_type": "CC Historical Commission",
        "priority": 0.008505780618565396,
        "last_update": 1766328656.381425
    },
    "MCM00001805": {
        "title": "Medford School Committee 09-08-25",
        "channel": "MCM Archive",
        "duration": 0,
        "upload_date": "2025-09-09",
        "view_count": 10,
        "date": "2025-09-08",
        "url": "https://archive.org/details/school-committee-09-08-25",
        "priority": 0.008505780618565396,
        "meeting_type": "MPS School Committee",
        "duplicate_id": "3V7oKmMkJx0",
        "skip": true
    },
    "XXXXXX00137": {
        "title": "Jessica Parks, Candidate for School Committee",
        "channel": "Medford Bytes",
        "duration": 1710,
        "upload_date": "2025-09-08",
        "view_count": 100,
        "date": "2025-09-08",
        "priority": 0.008505780618565396,
        "url": "https://open.spotify.com/episode/2EhMvY6NLSg06tdeHG3gBh",
        "last_update": 1759967676.1947725,
        "meeting_type": "Medford Bytes"
    },
    "3V7oKmMkJx0": {
        "title": "09.08.2025 MSC Regular Meeting (In Person)",
        "channel": "Medford Public Schools",
        "duration": 8538,
        "upload_date": "2025-09-08",
        "view_count": 32,
        "date": "2025-09-08",
        "priority": 0.008505780618565396,
        "last_update": 1758114250.1957207,
        "meeting_type": "MPS School Committee",
        "duplicate_id": "MCM00001805"
    },
    "MCM00001804": {
        "title": "Medford Bicycle Advisory Commission 09-03-25",
        "channel": "MCM Archive",
        "duration": 7766,
        "upload_date": "2025-09-04",
        "view_count": 10,
        "date": "2025-09-03",
        "url": "https://archive.org/details/bicycle-advisory-commission-09-03-25",
        "priority": 0.008158795975182704,
        "meeting_type": "CC Bicycling Advisory Commission",
        "last_update": 1765594375.6103578
    },
    "MCM00001803": {
        "title": "Medford Conservation Commission 09-03-25",
        "channel": "MCM Archive",
        "duration": 2282,
        "upload_date": "2025-09-04",
        "view_count": 10,
        "date": "2025-09-03",
        "url": "https://archive.org/details/conservation-commission-09-03-25",
        "priority": 0.008158795975182704,
        "meeting_type": "CC Conservation Commission",
        "last_update": 1766332591.329736
    },
    "XXXXXX00136": {
        "title": "Liz Mullane, Candidate for City Council ",
        "channel": "Medford Bytes ",
        "duration": 1277.0,
        "upload_date": "2025-09-01",
        "view_count": 100,
        "date": "2025-09-01",
        "priority": 0.008027801584665633,
        "url": "https://open.spotify.com/episode/6AcbIBiXlG1tXiwtc1bpka",
        "last_update": 1760321821.8620725,
        "meeting_type": "Medford Bytes"
    },
    "MCM00001802": {
        "title": "Medford Zoning Board Of Appeals 08-28-25",
        "channel": "MCM Archive",
        "duration": 2895,
        "upload_date": "2025-08-29",
        "view_count": 10,
        "date": "2025-08-28",
        "url": "https://archive.org/details/zoning-board-of-appeals-08-28-25",
        "priority": 0.007778039357932816,
        "meeting_type": "CC Zoning Board of Appeals",
        "last_update": 1766343370.368851
    },
    "og30Vvr2J5c": {
        "title": "Medford City Council Candidate Forum 2025",
        "channel": "Medford Community Media",
        "duration": 3434,
        "upload_date": "2025-08-28",
        "view_count": 0,
        "date": "2025-08-28",
        "priority": 0.007778039357932816,
        "last_update": 1756460972.236417,
        "meeting_type": "Campaign"
    },
    "MCM00001801": {
        "title": "Medford Climate Equity Council 08-27-25",
        "channel": "MCM Archive",
        "duration": 4414,
        "upload_date": "2025-08-29",
        "view_count": 10,
        "date": "2025-08-27",
        "url": "https://archive.org/details/climate-equity-council-08-27-25",
        "priority": 0.0077180083849498204,
        "meeting_type": "CC Climate Equity Council",
        "last_update": 1766358098.7835524
    },
    "XXXXXX00135": {
        "title": "Milva McDonald (City Council)",
        "channel": "Medford Bytes",
        "duration": 1348,
        "upload_date": "2025-08-25",
        "view_count": 100,
        "date": "2025-08-25",
        "priority": 0.007600684097754177,
        "url": "https://open.spotify.com/episode/5J72AsQbfoDaD1bM6vQcOR",
        "last_update": 1760321477.4761534,
        "meeting_type": "Medford Bytes"
    },
    "MCM00001800": {
        "title": "Medford Board Of Assessors 08-20-25",
        "channel": "MCM Archive",
        "duration": 3228,
        "upload_date": "2025-08-21",
        "view_count": 10,
        "date": "2025-08-20",
        "url": "https://archive.org/details/board-of-assessors-08-20-25",
        "priority": 0.007322407564105326,
        "meeting_type": "CC Board of Assessors",
        "last_update": 1766362793.266198
    },
    "DvAYwvDCXNU": {
        "title": "Medford Happenings Episode 23   Milva McDonald 08 20 25",
        "channel": "Medford Happenings",
        "duration": 2325,
        "upload_date": "2025-09-16",
        "view_count": 1,
        "date": "2025-08-20",
        "priority": 0.007322407564105326,
        "last_update": 1760322678.557281,
        "meeting_type": "Medford Happenings"
    },
    "MCM00001799": {
        "title": "Medford Parks Commission 08-19-25",
        "channel": "MCM Archive",
        "duration": 2129,
        "upload_date": "2025-08-20",
        "view_count": 10,
        "date": "2025-08-19",
        "url": "https://archive.org/details/parks-commission-08-19-25",
        "priority": 0.007269179667920107,
        "meeting_type": "CC Park Commission",
        "last_update": 1766370430.9636889
    },
    "m_cYOp8mfxk": {
        "title": "Medford Jazz Festival 2025 - Sunday Aug 17th",
        "channel": "Medford Community Media",
        "duration": 9055,
        "upload_date": "2025-10-09",
        "view_count": 0,
        "date": "2025-08-17",
        "priority": 0.007165012146685927,
        "last_update": 1760198738.2653937,
        "meeting_type": "Jazz Festival"
    },
    "zaRTySnP3iE": {
        "title": "Medford Jazz Festival 2025 - Sunday Aug 17th",
        "channel": "Medford Community Media",
        "duration": 10720,
        "upload_date": "2025-08-12",
        "view_count": 10,
        "date": "2025-08-17",
        "priority": 0.007165012146685927,
        "last_update": 1760320511.9965596,
        "meeting_type": "Jazz Festival"
    },
    "W2VGda6Qnxg": {
        "title": "Medford Jazz Festival 2025 - Saturday Aug 16th",
        "channel": "Medford Community Media",
        "duration": 8703,
        "upload_date": "2025-08-12",
        "view_count": 8,
        "date": "2025-08-16",
        "priority": 0.007114039963932343,
        "last_update": 1760763792.509152,
        "meeting_type": "Jazz Festival"
    },
    "MGbQjqu5m8o": {
        "title": "Medford Jazz Festival 2025 - Saturday Aug 16th",
        "channel": "Medford Community Media",
        "duration": 7175,
        "upload_date": "2025-10-07",
        "view_count": 0,
        "date": "2025-08-16",
        "priority": 0.007114039963932343,
        "last_update": 1759983672.311487,
        "meeting_type": "Jazz Festival"
    },
    "kn5HbAhnwc8": {
        "title": "Medford Jazz Festival 2025 - Friday Aug 15th",
        "channel": "Medford Community Media",
        "duration": 7988,
        "upload_date": "2025-10-06",
        "view_count": 4,
        "date": "2025-08-15",
        "priority": 0.007063787894553746,
        "last_update": 1760329196.1938558,
        "meeting_type": "Jazz Festival"
    },
    "5pVO_fhrDLY": {
        "title": "Medford Jazz Festival 2025 - Friday Aug 15th",
        "channel": "Medford Community Media",
        "duration": 8179,
        "upload_date": "2025-08-12",
        "view_count": 8,
        "date": "2025-08-15",
        "priority": 0.007063787894553746,
        "last_update": 1760419307.351707,
        "meeting_type": "Jazz Festival"
    },
    "MCM00001798": {
        "title": "Medford Historic District Commission 08/14/25",
        "channel": "MCM Archive",
        "duration": 2170,
        "upload_date": "2025-08-18",
        "view_count": 10,
        "date": "2025-08-14",
        "url": "https://archive.org/details/historic-district-commission-08-14-25",
        "priority": 0.007014240785404322,
        "meeting_type": "CC Historical Commission",
        "last_update": 1766376336.6519828
    },
    "afnvZAYk2_M": {
        "title": "2025 Candidates Forum - Medford Public Library",
        "channel": "Medford Community Media",
        "duration": 4570,
        "upload_date": "2025-08-28",
        "view_count": 831,
        "date": "2025-08-14",
        "priority": 0.007014240785404322,
        "last_update": 1760321005.5304198,
        "meeting_type": "Campaign"
    },
    "MCM00001797": {
        "title": "Medford Affordable Housing Trust 08-13-25",
        "channel": "MCM Archive",
        "duration": 4637,
        "upload_date": "2025-08-14",
        "view_count": 10,
        "date": "2025-08-13",
        "url": "https://archive.org/details/affordable-housing-trust-08-13-25",
        "priority": 0.0069653839055281675,
        "meeting_type": "CC Affordable Housing Trust Fund Board",
        "last_update": 1766392827.131841
    },
    "MCM00001796": {
        "title": "Medford School Committee Special Meeting 08-13-25",
        "channel": "MCM Archive",
        "duration": 1264,
        "upload_date": "2025-08-13",
        "view_count": 10,
        "date": "2025-08-13",
        "url": "https://archive.org/details/school-committee-special-meeting-08-13-25",
        "priority": 0.0069653839055281675,
        "meeting_type": "MPS School Committee",
        "last_update": 1766379796.647721
    },
    "R1mdipx9dPE": {
        "title": "08.13.2025 SC Executive Session",
        "channel": "Medford Public Schools",
        "duration": 3892,
        "upload_date": "2025-08-14",
        "view_count": 11,
        "date": "2025-08-13",
        "priority": 0.0069653839055281675,
        "last_update": 1755318318.5358617,
        "meeting_type": "MPS School Committee Executive Session"
    },
    "WX-UWIC6r6A": {
        "title": "Medford Happenings w/ Trish Schiapelli",
        "channel": "Medford Happenings",
        "duration": 2380,
        "upload_date": "2025-08-12",
        "view_count": 2,
        "date": "2025-08-12",
        "priority": 0.006917202931557425,
        "last_update": 1755102749.3616927,
        "meeting_type": "Medford Happenings"
    },
    "MCM00001795": {
        "title": "Medford Historical Commission 08-11-25",
        "channel": "MCM Archive",
        "duration": 4196,
        "upload_date": "2025-08-12",
        "view_count": 10,
        "date": "2025-08-11",
        "url": "https://archive.org/details/historical-commission-08-11-25",
        "priority": 0.006869683933712277,
        "meeting_type": "CC Historical Commission",
        "last_update": 1766405967.627704
    },
    "MCM00001794": {
        "title": "Medford School Committee Subcommittee 08-11-25",
        "channel": "MCM Archive",
        "duration": 4181,
        "upload_date": "2025-08-12",
        "view_count": 10,
        "date": "2025-08-11",
        "url": "https://archive.org/details/school-committee-mhscbc-meeting-08-11-25",
        "priority": 0.006869683933712277,
        "meeting_type": "MPS School Committee",
        "last_update": 1766417827.5369685
    },
    "AhbnPsYYkrc": {
        "title": "MSBA Full Committee Meeting",
        "channel": "Medford Public Schools",
        "duration": 3569,
        "upload_date": "2025-08-11",
        "view_count": 4,
        "date": "2025-08-11",
        "priority": 0.006869683933712277,
        "last_update": 1755328743.4317088,
        "meeting_type": "MPS High School Building Committee"
    },
    "2OQcjzjN9wY": {
        "title": "Medford Happenings w/ Page Buldini",
        "channel": "Medford Happenings",
        "duration": 2031,
        "upload_date": "2025-08-07",
        "view_count": 4,
        "date": "2025-08-07",
        "priority": 0.006685962146748569,
        "last_update": 1754635159.0594275,
        "meeting_type": "Medford Happenings"
    },
    "MCM00001793": {
        "title": "Community Development Board 8/6/25",
        "channel": "MCM Archive",
        "duration": 0,
        "upload_date": "2025-08-07",
        "view_count": 10,
        "date": "2025-08-06",
        "url": "https://archive.org/details/community-development-board-08-06-25",
        "priority": 0.0066415569483961176,
        "meeting_type": "CC Community Development Board",
        "duplicate_id": "vrRzYV4mIZk",
        "skip": true
    },
    "vrRzYV4mIZk": {
        "title": "Community Development Board 08-06-25",
        "channel": "City of Medford, Massachusetts",
        "duration": 7097,
        "upload_date": "2025-08-11",
        "view_count": 0,
        "date": "2025-08-06",
        "priority": 0.0066415569483961176,
        "last_update": 1755177646.0908456,
        "meeting_type": "CC Community Development Board",
        "duplicate_id": "MCM00001793"
    },
    "MCM00001792": {
        "title": "City Council 8/5/25",
        "channel": "MCM Archive",
        "duration": 0,
        "upload_date": "2025-08-07",
        "view_count": 10,
        "date": "2025-08-05",
        "url": "https://archive.org/details/city-council-08-05-25",
        "priority": 0.0065977376977459585,
        "meeting_type": "CC City Council",
        "duplicate_id": "cZff0fmztDw",
        "skip": true
    },
    "cZff0fmztDw": {
        "title": "City Council 08-05-25",
        "channel": "City of Medford, Massachusetts",
        "duration": 23453,
        "upload_date": "2025-08-06",
        "view_count": 144,
        "date": "2025-08-05",
        "priority": 0.0065977376977459585,
        "last_update": 1763498110.6799119,
        "meeting_type": "CC City Council",
        "duplicate_id": "MCM00001792"
    },
    "XXXXXX00134": {
        "title": "Medford for Palestine ",
        "channel": "Medford Bytes ",
        "duration": 2423.0,
        "upload_date": "2025-08-04",
        "view_count": 100,
        "date": "2025-08-04",
        "url": "https://open.spotify.com/episode/6qOOJ7IyztxTw4H3hGYQBS",
        "priority": 0.006554492873027974,
        "last_update": 1759206528.9986362,
        "meeting_type": "Medford Bytes"
    },
    "MCM00001791": {
        "title": "Zoning Board Of Appeals 07/31/25",
        "channel": "MCM Archive",
        "duration": 4797,
        "upload_date": "2025-08-01",
        "view_count": 10,
        "date": "2025-07-31",
        "url": "https://archive.org/details/zoning-board-of-appeals-07-31-25",
        "priority": 0.006387037700672693,
        "meeting_type": "CC Zoning Board of Appeals",
        "last_update": 1766516305.8893464
    },
    "MCM00001790": {
        "title": "Bicycle Advisory Commission Meeting 07/30/25",
        "channel": "MCM Archive",
        "duration": 6834,
        "upload_date": "2025-07-31",
        "view_count": 10,
        "date": "2025-07-30",
        "url": "https://archive.org/details/bicycle-advisory-commission-meeting-07-30-25",
        "priority": 0.006346502350890151,
        "meeting_type": "CC Bicycling Advisory Commission",
        "last_update": 1766548625.8679547
    },
    "MCM00001789": {
        "title": "Poet Laureate Installation 07/30/25",
        "channel": "MCM Archive",
        "duration": 1607,
        "upload_date": "2025-07-31",
        "view_count": 10,
        "date": "2025-07-30",
        "url": "https://archive.org/details/poet-laureate-installation-07-30-25",
        "priority": 0.006346502350890151,
        "meeting_type": null,
        "last_update": 1766561837.3355594
    },
    "MCM00001788": {
        "title": "Affordable Housing Trust 07/30/25",
        "channel": "MCM Archive",
        "duration": 4649,
        "upload_date": "2025-07-31",
        "view_count": 10,
        "date": "2025-07-30",
        "url": "https://archive.org/details/affordable-housing-trust-07-30-25",
        "priority": 0.006346502350890151,
        "meeting_type": "CC Affordable Housing Trust Fund Board",
        "last_update": 1766558263.4799693
    },
    "XXXXXX00133": {
        "title": "John Intoppa (School Committee)",
        "channel": "Medford Bytes ",
        "duration": 2044.0,
        "upload_date": "2025-07-28",
        "view_count": 100,
        "date": "2025-07-28",
        "url": "https://open.spotify.com/episode/604KtT5euRW9xzcHjtqysN",
        "priority": 0.00626695585080997,
        "last_update": 1759214780.9420977,
        "meeting_type": "Medford Bytes"
    },
    "MCM00001787": {
        "title": "Medford Conservation Commission 07-23-25",
        "channel": "MCM Archive",
        "duration": 2937,
        "upload_date": "2025-07-29",
        "view_count": 10,
        "date": "2025-07-23",
        "url": "https://archive.org/details/conservation-commission-07-23-25",
        "priority": 0.006076548543570665,
        "meeting_type": "CC Conservation Commission",
        "last_update": 1766573758.8749485
    },
    "MCM00001786": {
        "title": "Mystic Valley Development Commission 07-23-25",
        "channel": "MCM Archive",
        "duration": 500,
        "upload_date": "2025-07-29",
        "view_count": 10,
        "date": "2025-07-23",
        "url": "https://archive.org/details/mystic-valley-development-commission-07-23-25",
        "priority": 0.006076548543570665,
        "meeting_type": "MPS High School Building Committee",
        "last_update": 1766564009.6209314
    },
    "Z6zl2TiJ9bc": {
        "title": "Medford Happenings w/ Nicole Branley",
        "channel": "Medford Happenings",
        "duration": 1657,
        "upload_date": "2025-07-23",
        "view_count": 7,
        "date": "2025-07-23",
        "priority": 0.006076548543570665,
        "last_update": 1754249831.308691,
        "meeting_type": "Medford Happenings"
    },
    "XXXXXX00132": {
        "title": "Zoning with Zac Bears",
        "channel": "Medford Bytes ",
        "duration": 1679.0,
        "upload_date": "2025-07-21",
        "view_count": 100,
        "date": "2025-07-21",
        "url": "https://open.spotify.com/episode/1Lr1YPIjF1p31NUermDI2w",
        "priority": 0.0060035863754784365,
        "last_update": 1760318483.115055,
        "meeting_type": "Medford Bytes"
    },
    "MCM00001785": {
        "title": "Medford City Council Planning and Permitting Committee 07-16-25",
        "channel": "MCM Archive",
        "duration": 0,
        "upload_date": "2025-07-29",
        "view_count": 10,
        "date": "2025-07-16",
        "url": "https://archive.org/details/city-council-planning-and-permitting-committee-07-16-25",
        "priority": 0.0058286231624490505,
        "meeting_type": "CC Planning and Permitting",
        "duplicate_id": "ar92W3uq2rI",
        "skip": true
    },
    "ar92W3uq2rI": {
        "title": "City Council Planning and Permitting Committee 07-16-25",
        "channel": "City of Medford, Massachusetts",
        "duration": 6838,
        "upload_date": "2025-07-17",
        "view_count": 366,
        "date": "2025-07-16",
        "priority": 0.0058286231624490505,
        "last_update": 1763690032.0253916,
        "meeting_type": "CC Planning and Permitting",
        "duplicate_id": "MCM00001785"
    },
    "76AnRcU6pIg": {
        "title": "Medford Happenings w/ Melanie Tringali",
        "channel": "Medford Happenings",
        "duration": 2174,
        "upload_date": "2025-07-16",
        "view_count": 31,
        "date": "2025-07-16",
        "priority": 0.0058286231624490505,
        "last_update": 1754246765.8721306,
        "meeting_type": "Medford Happenings"
    },
    "MCM00001784": {
        "title": "Medford Board Of Health 07-15-25",
        "channel": "MCM Archive",
        "duration": 2254,
        "upload_date": "2025-07-29",
        "view_count": 10,
        "date": "2025-07-15",
        "url": "https://archive.org/details/board-of-health-07-15-25",
        "priority": 0.0057948471819415336,
        "meeting_type": "CC Board of Health",
        "last_update": 1766579754.6873715
    },
    "MCM00001783": {
        "title": "Medford City Council 07-15-25",
        "channel": "MCM Archive",
        "duration": 0,
        "upload_date": "2025-07-29",
        "view_count": 10,
        "date": "2025-07-15",
        "url": "https://archive.org/details/city-council-07-15-25",
        "priority": 0.0057948471819415336,
        "meeting_type": "CC City Council",
        "duplicate_id": "Ig6AP1vJ1-8",
        "skip": true
    },
    "MCM00001782": {
        "title": "Medford City Council Committee Of The Whole  07-15-25",
        "channel": "MCM Archive",
        "duration": 0,
        "upload_date": "2025-07-29",
        "view_count": 10,
        "date": "2025-07-15",
        "url": "https://archive.org/details/city-council-committee-of-the-whole-07-15-25",
        "priority": 0.0057948471819415336,
        "meeting_type": "CC City Council Meeting of the Whole",
        "duplicate_id": "1dIxixg8FHg",
        "skip": true
    },
    "Ig6AP1vJ1-8": {
        "title": "City Council 07-15-25",
        "channel": "City of Medford, Massachusetts",
        "duration": 9532,
        "upload_date": "2025-07-16",
        "view_count": 116,
        "date": "2025-07-15",
        "priority": 0.0057948471819415336,
        "last_update": 1753728172.080846,
        "meeting_type": "CC City Council",
        "duplicate_id": "MCM00001783"
    },
    "1dIxixg8FHg": {
        "title": "City Council Committee of the Whole 07-15-25",
        "channel": "City of Medford, Massachusetts",
        "duration": 3659,
        "upload_date": "2025-07-16",
        "view_count": 40,
        "date": "2025-07-15",
        "priority": 0.0057948471819415336,
        "last_update": 1753724656.9819999,
        "meeting_type": "CC City Council Meeting of the Whole",
        "duplicate_id": "MCM00001782"
    },
    "MCM00001781": {
        "title": "Medford Historical Commission 07-14-25",
        "channel": "MCM Archive",
        "duration": 5617,
        "upload_date": "2025-07-29",
        "view_count": 10,
        "date": "2025-07-14",
        "url": "https://archive.org/details/historical-commission-07-14-25",
        "priority": 0.005761460399382305,
        "meeting_type": "CC Historical Commission",
        "last_update": 1766596817.6069548
    },
    "MCM00001780": {
        "title": "Community Development Board 07-14-25",
        "channel": "MCM Archive",
        "duration": 0,
        "upload_date": "2025-07-29",
        "view_count": 10,
        "date": "2025-07-14",
        "url": "https://archive.org/details/community-development-board-07-14-25",
        "priority": 0.005761460399382305,
        "meeting_type": "CC Community Development Board",
        "skip": true,
        "note": "download error, revisit"
    },
    "XXXXXX00131": {
        "title": "Miranda Brise\u00f1o (Candidate for City Council)",
        "channel": "Medford Bytes ",
        "duration": 2130.0,
        "upload_date": "2025-07-14",
        "view_count": 100,
        "date": "2025-07-14",
        "url": "https://open.spotify.com/episode/0OmcFXZuPqr9Ko69rUml99",
        "priority": 0.005761460399382305,
        "last_update": 1759229395.8137748,
        "meeting_type": "Medford Bytes"
    },
    "MCM00001778": {
        "title": "Medford Community Development Board 07-09-25",
        "channel": "MCM Archive",
        "duration": 0,
        "upload_date": "2025-07-10",
        "view_count": 10,
        "date": "2025-07-09",
        "url": "https://archive.org/details/community-development-board-07-09-25briefstronglanguage",
        "priority": 0.0056001356018754245,
        "meeting_type": "CC Community Development Board",
        "duplicate_id": "-nzz6eWSWpU",
        "skip": true
    },
    "MCM00001777": {
        "title": "Medford Conservation Commission 07-09-25",
        "channel": "MCM Archive",
        "duration": 5354,
        "upload_date": "2025-07-10",
        "view_count": 10,
        "date": "2025-07-09",
        "url": "https://archive.org/details/conservation-commission-07-09-25",
        "priority": 0.0056001356018754245,
        "meeting_type": "CC Conservation Commission",
        "last_update": 1765558216.4850314
    },
    "-nzz6eWSWpU": {
        "title": "Community Development Board 07-09-25",
        "channel": "City of Medford, Massachusetts",
        "duration": 14236,
        "upload_date": "2025-07-10",
        "view_count": 20,
        "date": "2025-07-09",
        "priority": 0.0056001356018754245,
        "last_update": 1763494025.9028072,
        "meeting_type": "CC Community Development Board",
        "duplicate_id": "MCM00001778"
    },
    "MCM00001776": {
        "title": "Medford Traffic Commission 07-08-25",
        "channel": "MCM Archive",
        "duration": 11105,
        "upload_date": "2025-07-09",
        "view_count": 10,
        "date": "2025-07-08",
        "url": "https://archive.org/details/traffic-commission-07-08-25",
        "priority": 0.005568948733806217,
        "meeting_type": "CC Traffic Commission",
        "last_update": 1766650456.8177032
    },
    "MCM00001775": {
        "title": "Community Preservation Committee 07-08-25",
        "channel": "MCM Archive",
        "duration": 6390,
        "upload_date": "2025-07-09",
        "view_count": 10,
        "date": "2025-07-08",
        "url": "https://archive.org/details/community-preservation-committee-07-08-25",
        "priority": 0.005568948733806217,
        "meeting_type": "CC Community Preservation Committee",
        "last_update": 1766615925.1343644
    },
    "XXXXXX00130": {
        "title": "Page Buldini, Candidate for City Council",
        "channel": "Medford Bytes ",
        "duration": 1609.0,
        "upload_date": "2025-07-07",
        "view_count": 100,
        "date": "2025-07-07",
        "url": "https://open.spotify.com/episode/0zJLIhYd1J4FjypS6aoJou",
        "priority": 0.0055381072981803324,
        "last_update": 1759249528.0422454,
        "meeting_type": "Medford Bytes"
    },
    "VUDphijP9hM": {
        "title": "Medford Happenings w/ Paul J. Donato Jr.",
        "channel": "Medford Happenings",
        "duration": 1631,
        "upload_date": "2025-07-05",
        "view_count": 0,
        "date": "2025-07-05",
        "priority": 0.0054774380192409555,
        "last_update": 1751944537.8948126,
        "meeting_type": "Medford Happenings"
    },
    "MCM00001767": {
        "title": "Medford Zoning Board Of Appeals 06 26 25",
        "channel": "MCM Archive",
        "duration": 5995,
        "upload_date": "2025-07-03",
        "view_count": 10,
        "date": "2025-06-26",
        "url": "https://archive.org/details/zoning-board-of-appeals-06-26-25",
        "priority": 0.005220102908045068,
        "last_update": 1765538223.3412278,
        "meeting_type": "CC Zoning Board of Appeals"
    },
    "sWYb-xB_aeg": {
        "title": "PUB - COM 9 VER 47",
        "channel": "Medford Community Media",
        "duration": 153,
        "upload_date": "2025-06-26",
        "view_count": 2,
        "date": "2025-06-26",
        "priority": 0.005220102908045068,
        "last_update": 1763689866.0258353,
        "meeting_type": null
    },
    "ZkVvlwQNw_U": {
        "title": "Community Development Board 06-25-25",
        "channel": "City of Medford, Massachusetts",
        "duration": 12468,
        "upload_date": "2025-07-03",
        "view_count": 2,
        "date": "2025-06-25",
        "priority": 0.005192994940057013,
        "last_update": 1753715558.994572,
        "meeting_type": "CC Community Development Board"
    },
    "MCM00001764": {
        "title": "City Council Committee Of The Whole 06-24-25",
        "channel": "MCM Archive",
        "duration": 0,
        "upload_date": "2025-06-26",
        "view_count": 10,
        "date": "2025-06-24",
        "url": "https://archive.org/details/city-council-committee-of-the-whole-06-24-25",
        "priority": 0.00516616706065156,
        "meeting_type": "CC City Council Meeting of the Whole",
        "duplicate_id": "mq1Fm7aNgqA",
        "skip": true
    },
    "mq1Fm7aNgqA": {
        "title": "City Council Committee of the Whole Meeting 06-24-25",
        "channel": "City of Medford, Massachusetts",
        "duration": 2596,
        "upload_date": "2025-06-24",
        "view_count": 24,
        "date": "2025-06-24",
        "priority": 0.00516616706065156,
        "last_update": 1760317938.5735419,
        "meeting_type": "CC City Council Meeting of the Whole",
        "duplicate_id": "MCM00001764"
    },
    "rov34HMcKiU": {
        "title": "City Council 06-24-25",
        "channel": "City of Medford, Massachusetts",
        "duration": 15506,
        "upload_date": "2025-06-24",
        "view_count": 103,
        "date": "2025-06-24",
        "priority": 0.00516616706065156,
        "last_update": 1763475880.0996063,
        "meeting_type": "CC City Council"
    },
    "k00YYHPhilI": {
        "title": "Medford Happenings w/ Patrick Clerkin",
        "channel": "Medford Happenings",
        "duration": 1854,
        "upload_date": "2025-06-24",
        "view_count": 4,
        "date": "2025-06-24",
        "priority": 0.00516616706065156,
        "last_update": 1751008137.4776516,
        "meeting_type": "Medford Happenings"
    },
    "XXXXXX00129": {
        "title": "Patrick Clerkin",
        "channel": "Medford Bytes ",
        "duration": 2543.0,
        "upload_date": "2025-06-23",
        "view_count": 100,
        "date": "2025-06-23",
        "url": "https://open.spotify.com/episode/3lkP0aJyhqdYr7q34R7wmL",
        "priority": 0.005139614951186309,
        "last_update": 1759264290.4458437,
        "meeting_type": "Medford Bytes"
    },
    "Yqwco1gJdRs": {
        "title": "2025 Kickoff Speech",
        "channel": "Matt Leming",
        "duration": 707,
        "upload_date": "2025-06-22",
        "view_count": 2,
        "date": "2025-06-22",
        "priority": 0.005113334381349511,
        "last_update": 1750648330.8266985,
        "meeting_type": "Campaign"
    },
    "iJqG--ERMpI": {
        "title": "Medford Happenings w/ Mystic Players Revival",
        "channel": "Medford Happenings",
        "duration": 1575,
        "upload_date": "2025-06-19",
        "view_count": 1,
        "date": "2025-06-19",
        "priority": 0.005036080884743857,
        "last_update": 1751007372.9470992,
        "meeting_type": "Medford Happenings"
    },
    "hLm7uOhMYTQ": {
        "title": "Community Development Board 06-18-25",
        "channel": "City of Medford, Massachusetts",
        "duration": 14708,
        "upload_date": "2025-06-26",
        "view_count": 2,
        "date": "2025-06-18",
        "priority": 0.005010845859693457,
        "last_update": 1763476162.2726252,
        "meeting_type": "CC Community Development Board"
    },
    "yGcuIBQZTjc": {
        "title": "06.18.2025 Last Regular School Committee Meeting",
        "channel": "Medford Public Schools",
        "duration": 10708,
        "upload_date": "2025-06-18",
        "view_count": 22,
        "date": "2025-06-18",
        "priority": 0.005010845859693457,
        "last_update": 1750729667.3546348,
        "meeting_type": "MPS School Committee"
    },
    "R-MRxkQx_nA": {
        "title": "WMCC Fresh Fridays Words and Music - 06-13-25",
        "channel": "Medford Community Media",
        "duration": 7618,
        "upload_date": "2025-06-13",
        "view_count": 12,
        "date": "2025-06-13",
        "priority": 0.004888371479743866,
        "last_update": 1760317775.6430228,
        "meeting_type": "West Medford Community Center"
    },
    "aDOHyHAgxKE": {
        "title": "City Council Planning and Permitting Committee 06-11-25",
        "channel": "City of Medford, Massachusetts",
        "duration": 7792,
        "upload_date": "2025-06-11",
        "view_count": 22,
        "date": "2025-06-11",
        "priority": 0.004841041857843609,
        "last_update": 1749858969.2596626,
        "meeting_type": "CC Planning and Permitting"
    },
    "VUGwCJcKl8M": {
        "title": "FE&C SubCommittee Meeting",
        "channel": "Medford Public Schools",
        "duration": 3713,
        "upload_date": "2025-06-11",
        "view_count": 31,
        "date": "2025-06-11",
        "priority": 0.004841041857843609,
        "last_update": 1760759114.2912257,
        "meeting_type": "MPS Family Engagement & Communication"
    },
    "eVGy96zbLTU": {
        "title": "MCHSBC Full Meeting",
        "channel": "Medford Public Schools",
        "duration": 3837,
        "upload_date": "2025-06-11",
        "view_count": 13,
        "date": "2025-06-11",
        "priority": 0.004841041857843609,
        "last_update": 1759311096.280446,
        "meeting_type": "MPS High School Building Committee"
    },
    "LoB1uXiSLjg": {
        "title": "Medford Happenings w/ Nick Giurleo",
        "channel": "Medford Happenings",
        "duration": 1742,
        "upload_date": "2025-06-11",
        "view_count": 0,
        "date": "2025-06-11",
        "priority": 0.004841041857843609,
        "last_update": 1751003912.8378427,
        "meeting_type": "Medford Happenings"
    },
    "a519TYOBRJE": {
        "title": "City Council 06-10-25",
        "channel": "City of Medford, Massachusetts",
        "duration": 13595,
        "upload_date": "2025-06-10",
        "view_count": 47,
        "date": "2025-06-10",
        "priority": 0.004817719078127064,
        "last_update": 1753526071.80443,
        "meeting_type": "CC City Council"
    },
    "MCM00001769": {
        "title": "Medford School Committee 06-09-25",
        "channel": "MCM Archive",
        "duration": 0,
        "upload_date": "2025-07-07",
        "view_count": 10,
        "date": "2025-06-09",
        "url": "https://archive.org/details/school-committee-06-09-25",
        "priority": 0.004794619946140176,
        "meeting_type": "MPS School Committee",
        "duplicate_id": "CsSw9Cunt1k",
        "skip": true
    },
    "XXXXXX00128": {
        "title": "Matt Leming for City Council",
        "channel": "Medford Bytes ",
        "duration": 2027.0,
        "upload_date": "2025-06-09",
        "view_count": 100,
        "date": "2025-06-09",
        "url": "https://open.spotify.com/episode/1nlbnh9NlbBVvZM2e2GDT6",
        "priority": 0.004794619946140176,
        "last_update": 1759340647.0756032,
        "meeting_type": "Medford Bytes"
    },
    "CsSw9Cunt1k": {
        "title": "06.09.2025 Regular MSC Meeting",
        "channel": "Medford Public Schools",
        "duration": 6362,
        "upload_date": "2025-06-09",
        "view_count": 78,
        "date": "2025-06-09",
        "priority": 0.004794619946140176,
        "last_update": 1750997537.827736,
        "meeting_type": "MPS School Committee",
        "duplicate_id": "MCM00001769"
    },
    "nxzvg6ywlhM": {
        "title": "Zoning Q&A/Info Session - Parking Strategies 06-09-25",
        "channel": "City of Medford, Massachusetts",
        "duration": 7676,
        "upload_date": "2025-06-26",
        "view_count": 0,
        "date": "2025-06-09",
        "priority": 0.004794619946140176,
        "last_update": 1753655501.245746,
        "meeting_type": "CC Community Development Board"
    },
    "MCM00001766": {
        "title": "City Council Resident Services And Public Engagement 06-04-25",
        "channel": "MCM Archive",
        "duration": 3068,
        "upload_date": "2025-07-03",
        "view_count": 10,
        "date": "2025-06-04",
        "url": "https://archive.org/details/city-council-resident-services-and-public-engagement-06-04-25",
        "priority": 0.004682369046023898,
        "meeting_type": "CC Resident Services and Public Engagement Committee",
        "last_update": 1766652771.5470452
    },
    "M2dn2QxmG2g": {
        "title": "Community Development Board 06-04-25",
        "channel": "City of Medford, Massachusetts",
        "duration": 12468,
        "upload_date": "2025-06-26",
        "view_count": 0,
        "date": "2025-06-04",
        "priority": 0.004682369046023898,
        "last_update": 1753638173.914347,
        "meeting_type": "CC Community Development Board"
    },
    "8gpW9hN9Tuo": {
        "title": "Special MSC Meeting",
        "channel": "Medford Public Schools",
        "duration": 8578,
        "upload_date": "2025-06-03",
        "view_count": 28,
        "date": "2025-06-03",
        "priority": 0.004660546646667989,
        "last_update": 1749878198.8998368,
        "meeting_type": "MPS School Committee"
    },
    "a9xOVRCPDrM": {
        "title": "Public Works and Facilities Committee Meeting via Zoom",
        "channel": "City of Medford, Massachusetts",
        "duration": 2699,
        "upload_date": "2025-06-03",
        "view_count": 26,
        "date": "2025-06-03",
        "priority": 0.004660546646667989,
        "last_update": 1749879003.6912243,
        "meeting_type": "CC Public Works and Facilities"
    },
    "s093VSbtp08": {
        "title": "MSBA Full Meeting (Vote)",
        "channel": "Medford Public Schools",
        "duration": 743,
        "upload_date": "2025-06-02",
        "view_count": 4,
        "date": "2025-06-02",
        "priority": 0.004638926712334679,
        "last_update": 1749877009.5795298,
        "meeting_type": "MPS High School Building Committee"
    },
    "y5VYRogAU7s": {
        "title": "Spanish Labor and Social Economy Minister Yolanda D\u00edaz at the ASETT Forum - May 30, 2025",
        "channel": "Mass Traction-US-Medford-1 - Government",
        "duration": 619,
        "upload_date": "2025-06-04",
        "view_count": 17,
        "date": "2025-05-30",
        "priority": 0.004575253909603756,
        "last_update": 1749880362.1452997,
        "meeting_type": null
    },
    "MCM00001768": {
        "title": "Public Q& A On Corridor Proposals 05-29-25",
        "channel": "MCM Archive",
        "duration": 7683,
        "upload_date": "2025-07-03",
        "view_count": 10,
        "date": "2025-05-29",
        "url": "https://archive.org/details/public-q-a-on-corridor-proposals-05-29-25",
        "priority": 0.004554416298627497,
        "meeting_type": null,
        "last_update": 1766676216.7301207
    },
    "Nl3sf1HT5lI": {
        "title": "Zoning Q&A/Info Session - Corridor Proposals 05-29-25",
        "channel": "City of Medford, Massachusetts",
        "duration": 7683,
        "upload_date": "2025-07-10",
        "view_count": 1,
        "date": "2025-05-29",
        "priority": 0.004554416298627497,
        "last_update": 1753723356.2522388,
        "meeting_type": "CC Community Development Board"
    },
    "IdMgzj9PVYQ": {
        "title": "CPlanning and Permitting Committee Meeting 05-28-25",
        "channel": "City of Medford, Massachusetts",
        "duration": 6376,
        "upload_date": "2025-05-28",
        "view_count": 16,
        "date": "2025-05-28",
        "priority": 0.004533767633423643,
        "last_update": 1749873336.6318424,
        "meeting_type": "CC Planning and Permitting"
    },
    "dARoc_Yp358": {
        "title": "Medford Happenings w/ Nate Merritt",
        "channel": "Medford Happenings",
        "duration": 1939,
        "upload_date": "2025-05-28",
        "view_count": 4,
        "date": "2025-05-28",
        "priority": 0.004533767633423643,
        "last_update": 1749872080.2793307,
        "meeting_type": "Medford Happenings"
    },
    "IP1sqjGemck": {
        "title": "City Council Committee of the Whole 05-27-25",
        "channel": "City of Medford, Massachusetts",
        "duration": 10076,
        "upload_date": "2025-05-28",
        "view_count": 73,
        "date": "2025-05-27",
        "priority": 0.004513305355682293,
        "last_update": 1749876599.7639732,
        "meeting_type": "CC City Council Meeting of the Whole"
    },
    "B1AX1IdGJno": {
        "title": "City Council 05-27-25",
        "channel": "City of Medford, Massachusetts",
        "duration": 9436,
        "upload_date": "2025-05-27",
        "view_count": 64,
        "date": "2025-05-27",
        "priority": 0.004513305355682293,
        "last_update": 1749870996.2421074,
        "meeting_type": "CC City Council"
    },
    "XXXXXX00127": {
        "title": "Moon and Back Bookstore",
        "channel": "Medford Bytes ",
        "duration": 1109.0,
        "upload_date": "2025-05-26",
        "view_count": 100,
        "date": "2025-05-26",
        "url": "https://open.spotify.com/episode/3lY7oMYtrfsRS3Z2JjpJdT",
        "priority": 0.004493026953071769,
        "last_update": 1759340506.7943192,
        "meeting_type": "Medford Bytes"
    },
    "rqFXCDjAlME": {
        "title": "2025 Campaign Kickoff!",
        "channel": "Matt Leming",
        "duration": 98,
        "upload_date": "2025-05-25",
        "view_count": 6,
        "date": "2025-05-25",
        "priority": 0.0044729299582103275,
        "last_update": 1749290620.113812,
        "meeting_type": "Campaign"
    },
    "R3lNHO5Xbl8": {
        "title": "Committee of the Whole Meeting via Zoom",
        "channel": "City of Medford, Massachusetts",
        "duration": 13774,
        "upload_date": "2025-05-22",
        "view_count": 62,
        "date": "2025-05-22",
        "priority": 0.004413703399720533,
        "last_update": 1753521319.406017,
        "meeting_type": "CC City Council Meeting of the Whole"
    },
    "eDgDbZ9kFxs": {
        "title": "Committee of the Whole Meeting via Zoom",
        "channel": "City of Medford, Massachusetts",
        "duration": 8038,
        "upload_date": "2025-05-20",
        "view_count": 27,
        "date": "2025-05-20",
        "priority": 0.004375082764378145,
        "last_update": 1749286170.3715777,
        "meeting_type": "CC City Council Meeting of the Whole"
    },
    "9fui-IqEKvo": {
        "title": "Strategic and Capital Planning Subcommittee Meeting",
        "channel": "Medford Public Schools",
        "duration": 5543,
        "upload_date": "2025-05-20",
        "view_count": 23,
        "date": "2025-05-20",
        "priority": 0.004375082764378145,
        "last_update": 1753516607.7761278,
        "meeting_type": "MPS Strategic & Capital Planning"
    },
    "0Ih-_-yl5i8": {
        "title": "Public Works and Facilities Committee Meeting via Zoom",
        "channel": "City of Medford, Massachusetts",
        "duration": 2899,
        "upload_date": "2025-05-20",
        "view_count": 12,
        "date": "2025-05-20",
        "priority": 0.004375082764378145,
        "last_update": 1753514902.5644581,
        "meeting_type": "CC Public Works and Facilities"
    },
    "Bb2OGdaRgK0": {
        "title": "Medford Happenings w/ Harley Racer",
        "channel": "Medford Happenings",
        "duration": 1268,
        "upload_date": "2025-05-20",
        "view_count": 8,
        "date": "2025-05-20",
        "priority": 0.004375082764378145,
        "last_update": 1749283700.408542,
        "meeting_type": "Medford Happenings"
    },
    "SGdnUuDa2t4": {
        "title": "05.19.2025 Regular MSC Meeting",
        "channel": "Medford Public Schools",
        "duration": 8055,
        "upload_date": "2025-05-19",
        "view_count": 36,
        "date": "2025-05-19",
        "priority": 0.004356024795374697,
        "last_update": 1749280534.8758342,
        "meeting_type": "MPS School Committee"
    },
    "v1jzPrb1DFs": {
        "title": "Medford City Council Meeting via Zoom",
        "channel": "City of Medford, Massachusetts",
        "duration": 12597,
        "upload_date": "2025-05-14",
        "view_count": 92,
        "date": "2025-05-14",
        "priority": 0.004263172372565439,
        "last_update": 1753513876.9866934,
        "meeting_type": "CC City Council"
    },
    "mde-MlDPW-g": {
        "title": "Planning and Permitting Committee Meeting via Zoom",
        "channel": "City of Medford, Massachusetts",
        "duration": 6566,
        "upload_date": "2025-05-14",
        "view_count": 9,
        "date": "2025-05-14",
        "priority": 0.004263172372565439,
        "last_update": 1749277980.2380614,
        "meeting_type": "CC Planning and Permitting"
    },
    "MCM00001765": {
        "title": "City Council 05-13-25",
        "channel": "MCM Archive",
        "duration": 11387,
        "upload_date": "2025-07-01",
        "view_count": 10,
        "date": "2025-05-13",
        "url": "https://archive.org/details/city-council-05-13-25",
        "priority": 0.00424507488658946,
        "meeting_type": "CC City Council",
        "last_update": 1766709266.4438612
    },
    "Gg7MfqcnomU": {
        "title": "MHCSBC Full Meeting - May 12, 2025",
        "channel": "Medford Public Schools",
        "duration": 6843,
        "upload_date": "2025-05-12",
        "view_count": 9,
        "date": "2025-05-12",
        "priority": 0.004227130401479799,
        "last_update": 1748301709.7816675,
        "meeting_type": "MPS High School Building Committee"
    },
    "fJPuZ1xCyoY": {
        "title": "Red Cards",
        "channel": "Matt Leming",
        "duration": 1122,
        "upload_date": "2025-05-11",
        "view_count": 1,
        "date": "2025-05-11",
        "priority": 0.004209336985139841,
        "last_update": 1748300151.3506496,
        "meeting_type": "Campaign"
    },
    "EO-vAhUJAKo": {
        "title": "Zoning Q&A/Info Session - Medford Square 05-08-25",
        "channel": "City of Medford, Massachusetts",
        "duration": 8897,
        "upload_date": "2025-06-26",
        "view_count": 0,
        "date": "2025-05-08",
        "priority": 0.004156844309657513,
        "last_update": 1759315187.3949907,
        "meeting_type": "CC Community Development Board"
    },
    "fVaQLb3MmlA": {
        "title": "Community Development Board 05-07-25",
        "channel": "City of Medford, Massachusetts",
        "duration": 7542,
        "upload_date": "2025-06-26",
        "view_count": 0,
        "date": "2025-05-07",
        "priority": 0.004139636485289587,
        "last_update": 1751193193.1657338,
        "meeting_type": "CC Community Development Board",
        "duplicate_id": "DObjiEFtXck"
    },
    "DObjiEFtXck": {
        "title": "Community Development Board 05-07-2025",
        "channel": "Select Medford, MA City Meetings",
        "duration": 7542,
        "upload_date": "2025-05-10",
        "view_count": 0,
        "date": "2025-05-07",
        "priority": 0.004139636485289587,
        "last_update": 1749276883.8095682,
        "meeting_type": "CC Community Development Board",
        "duplicate_id": "fVaQLb3MmlA",
        "skip": true
    },
    "HW_5AfM_YUs": {
        "title": "Public Health and Community Safety Committee 05-07-25",
        "channel": "City of Medford, Massachusetts",
        "duration": 5674,
        "upload_date": "2025-05-07",
        "view_count": 23,
        "date": "2025-05-07",
        "priority": 0.004139636485289587,
        "last_update": 1748298654.1398947,
        "meeting_type": "CC Public Health and Community Safety"
    },
    "lGHiIPcdGwg": {
        "title": "City Council Resident Services and Public Engagement Committee 05-07-25",
        "channel": "City of Medford, Massachusetts",
        "duration": 4974,
        "upload_date": "2025-05-07",
        "view_count": 13,
        "date": "2025-05-07",
        "priority": 0.004139636485289587,
        "last_update": 1753509352.520824,
        "meeting_type": "CC Resident Services and Public Engagement Committee"
    },
    "zzXcJKCGyZo": {
        "title": "City Council Committee of the Whole 05-06-25",
        "channel": "City of Medford, Massachusetts",
        "duration": 9464,
        "upload_date": "2025-05-06",
        "view_count": 40,
        "date": "2025-05-06",
        "priority": 0.004122570541861317,
        "last_update": 1753507354.0766866,
        "meeting_type": "CC City Council Meeting of the Whole"
    },
    "XXXXXX00126": {
        "title": "Dave McGillivray and Run Medford",
        "channel": "Medford Bytes ",
        "duration": 1575.0,
        "upload_date": "2025-05-05",
        "view_count": 100,
        "date": "2025-05-05",
        "url": "https://open.spotify.com/episode/4lqQ8bRRMJFxG5HNizTRRS",
        "priority": 0.004105644731834508,
        "last_update": 1759340301.9453878,
        "meeting_type": "Medford Bytes"
    },
    "V2-HjCd92gQ": {
        "title": "05.05.2025 Regular MSC Meeting",
        "channel": "Medford Public Schools",
        "duration": 3087,
        "upload_date": "2025-05-06",
        "view_count": 25,
        "date": "2025-05-05",
        "priority": 0.004105644731834508,
        "last_update": 1748296401.435575,
        "meeting_type": "MPS School Committee"
    },
    "nSVrs1f-rd8": {
        "title": "City Council Resident Services and Public Engagement Committee 05-04-25",
        "channel": "City of Medford, Massachusetts",
        "duration": 3778,
        "upload_date": "2025-06-04",
        "view_count": 16,
        "date": "2025-05-04",
        "priority": 0.0040888573362527,
        "last_update": 1749880270.611097,
        "meeting_type": "CC Resident Services and Public Engagement Committee"
    },
    "M70IRxkp2Zo": {
        "title": "Medford Happenings w/ Ron Giovino",
        "channel": "Medford Happenings",
        "duration": 2239,
        "upload_date": "2025-05-03",
        "view_count": 0,
        "date": "2025-05-03",
        "priority": 0.004072206664159215,
        "last_update": 1748294614.4607434,
        "meeting_type": "Medford Happenings"
    },
    "nRpogo_iMto": {
